bank,bank_file,label,snes_addr,source_line,word_count,byte_count,terminated,text
B9,bank_B9.asm,Text_295_Dialog_ThumpThumpThump,B98790,142,21,42,True,Thump:thump:thump...
B9,bank_B9.asm,Text_296_Animal_EllenGoodCookAndtakesGood,B987BA,146,121,242,True,"Yes:Ellen is a good cook andtakes good care of the      livestock.
She is a nice and steady    girl. Don't you think so?"
B9,bank_B9.asm,Text_297_Romance_LoveMyWifesCakeBut,B988AC,163,65,130,True,I love my wife's cake but mydaughter's makes me so much happier.
B9,bank_B9.asm,Text_298_Dialog_ScorchedCakeAgain,B9892E,173,27,54,True,I scorched the cake again.
B9,bank_B9.asm,Text_299_Dialog_WhatShouldIDo,B98964,178,18,36,True,What should I do?
B9,bank_B9.asm,Text_29A_Romance_AnnsHandMadeCakeExplode,B98988,182,51,102,True,Ann's hand-made cake...it   won't explode:will it?
B9,bank_B9.asm,Text_29B_Romance_GetCakeMariaEveryYear,B989EE,190,40,80,True,I get a cake from Maria     every year.
B9,bank_B9.asm,Text_29C_Romance_YeahGotCakeMaria,B98A3E,196,35,70,True,"Yeah:I got a cake from      Maria,"
B9,bank_B9.asm,Text_29D_Animal_AbleBakePerfectlyDeliciousCake,B98A84,202,79,158,True,"I'll be able to bake a      perfectly delicious cake    when I get older, Gee,"
B9,bank_B9.asm,Text_29E_Dialog_HopeLike,B98B22,213,46,92,True,Hi:well...it's for you.I    hope you like it.
B9,bank_B9.asm,Text_29F_Romance_UummThankWorkingEveryDay,B98B7E,220,39,78,True,uumm:thank you for working  every day.
B9,bank_B9.asm,Text_2A0_Dialog_Hello,B98BCC,226,7,14,True,Hello.
B9,bank_B9.asm,Text_2A1_Dialog_GiveNotsureIfTastesGood,B98BDA,228,61,122,True,I'll give it to you. I'm notsure if it tastes good or   not.
B9,bank_B9.asm,Text_2A2_Dialog_WantMedicineCase,B98C54,237,34,68,True,You want medicine just in   case?
B9,bank_B9.asm,Text_2A3_Dialog_MyDadRudeLookedatMy,B98C98,243,67,134,True,My dad is so rude. He lookedat my cake carefully before he ate it.
B9,bank_B9.asm,Text_2A4_Dialog_SpecialHerbCake,B98D1E,253,39,78,True,Here it is. It's a special  herb cake.
B9,bank_B9.asm,Text_2A5_Dialog_LookVeryGoodButDelicious,B98D6C,259,52,104,True,It doesn't look very good   but isn't it delicious?
B9,bank_B9.asm,Text_2A6_Dialog_MyMomWanderingAroundBaked,B98DD4,267,82,164,True,My mom is wandering around  with a baked cake in her    hands since this morning.
B9,bank_B9.asm,Text_2A7_Animal_UsedPlentyMilkEggs,B98E78,279,34,68,True,I used plenty of milk and   eggs.
B9,bank_B9.asm,Text_2A8_Dialog_HaveConfidenceMakingSweets,B98EBC,285,36,72,True,I have confidence in making sweets.
B9,bank_B9.asm,Text_2A9_Dialog_ProbablyThinkMonkeySomethingRight,B98F04,291,99,198,True,"Hey:you probably think I'm  a monkey or something:      right?
.........That's OK with me  though."
B9,bank_B9.asm,Text_2AA_Dialog_CakeFulledBerries,B98FCA,305,37,74,True,This is a cake fulled with  berries.
B9,bank_B9.asm,Text_2AB_Dialog_HopeLike,B99014,311,20,40,True,I hope you like it.
B9,bank_B9.asm,Text_2AC_Festival_NowStarNightFestivalTomorrow,B9903C,315,134,268,True,"Now it's the Star Night     Festival tomorrow. It'll be nice with the clear blue
sky so you'll see the       beautiful star at night."
B9,bank_B9.asm,Text_2AD_Animal_StarNightFestivalSupposedPray,B99148,333,128,256,True,"On the Star Night Festival  you are supposed to pray forthe night when
you can see the most        beautiful stars of the year."
B9,bank_B9.asm,Text_2AE_Dialog_LookSkyItllBeautifulTomorrow,B99248,350,63,126,True,Look at the sky. It'll be   really beautiful tomorrow   night.
B9,bank_B9.asm,Text_2AF_Church_GoingPlayOrganChurch,B992C6,359,40,80,True,I'm going to play organ at  the church.
B9,bank_B9.asm,Text_2B0_Dialog_TomorrowHehHehGoingWonderful,B99316,365,50,100,True,Tomorrow? Heh-heh:I'm going to a wonderful place.
B9,bank_B9.asm,Text_2B1_Dialog_SayGoingNearestplaceStars,B9937A,373,48,96,True,Say:I'm going to the nearestplace to the stars.
B9,bank_B9.asm,Text_2B2_Church_PrayPublicSquareRomantic,B993DA,380,49,98,True,We'll pray at the public    square. So romantic.
B9,bank_B9.asm,Text_2B3_Dialog_LetsHaveBallTomorrowWaiting,B9943C,388,49,98,True,Let's have a ball tomorrow. I'm waiting for you.
B9,bank_B9.asm,Text_2B4_Festival_StarNightFestivaltomorrowGoingPlace,B9949E,396,75,150,True,It's the Star Night Festivaltomorrow. I'm going to the  place I always go.
B9,bank_B9.asm,Text_2B5_Festival_StarNightFestivaltomorrowGoingPlace,B99534,407,103,206,True,"It's the Star Night Festivaltomorrow, I'm going to the  place I always go so
please come see me there."
B9,bank_B9.asm,Text_2B6_Sign_StarNightFestivaltodayGoPublic,B99602,421,116,232,False,"It's the Star Night Festivaltoday, Where should I go?
 Public square  Mountain top Church         Spa          Bar<CHOICE_OR_WAIT>f"
B9,bank_B9.asm,Text_2B7_Church_LadiesGentlemenLetsPrayStars,B996EA,437,54,108,True,Well: ladies and gentlemen. Let's pray for the stars.
B9,bank_B9.asm,Text_2B8_Animal_LightStarsSeeingNowMillions,B99756,445,114,228,True,"The light of the stars we   are seeing now is that of   millions of years ago.
It's mysterious when I thinkof it."
B9,bank_B9.asm,Text_2B9_Dialog_MayMyBusinessGetBetter,B9983A,461,36,72,True,...May my business get      better.
B9,bank_B9.asm,Text_2BA_Dialog_WantMeReadHoroscopeSure,B99882,467,79,158,False,"Do you want me to read your horoscope?
 Sure                        No thanks<CHOICE_OR_WAIT>c"
B9,bank_B9.asm,Text_2BB_Romance_GirlWhoGetsAlongWellwith,B99920,478,61,122,True,"The girl who gets along wellwith you is no one but      <CTRL_FFFD>fw,"
B9,bank_B9.asm,Text_2BC_Dialog_WantKnow,B9999A,487,34,68,True,Really? Don't you want to   know?
B9,bank_B9.asm,Text_2BD_Animal_CloseMyEyesFeellikeFloating,B999DE,493,67,134,True,When I close my eyes: I feellike I'm floating in the    night sky.
B9,bank_B9.asm,Text_2BE_Church_PrayEverybodysGoodHealthSecret,B99A64,503,81,162,True,What did I pray for?        Everybody's good health.    ....And.. It's a secret.
B9,bank_B9.asm,Text_2BF_Romance_StarsShinningAllTimeSeethem,B99B06,515,207,414,True,"The stars are shinning all  the time. You just can't seethem because of those
lights and stuff on the     earth. And same as the      stars:the truth and love
always exist. You just don'tsee. Yes:it's true."
B9,bank_B9.asm,Text_2C0_Church_SometimesWorkEvenifMuchLove,B99CA4,542,117,234,True,"It sometimes won't work evenif we are so much in love:  will it?
In that case: all you have  to do is pray: I guess."
B9,bank_B9.asm,Text_2C1_Diary_FeelSleepyNow,B99D8E,558,22,44,True,...I feel sleepy now.
B9,bank_B9.asm,Text_2C2_Dialog_Zzzzzzz,B99DBA,562,13,26,True,Zzzzzzz.....
B9,bank_B9.asm,Text_2C3_Dialog_ThinkHaveGoodDreamTonight,B99DD4,565,43,86,True,I think I'll have a good    dream tonight.
B9,bank_B9.asm,Text_2C4_Romance_GoodEveningUmmWishweAlso,B99E2A,572,80,160,True,Good evening. ....Umm:I wishwe could also spend some    time together nextyear.
B9,bank_B9.asm,Text_2C5_Dialog_LetsSingSongEnjoyYourselves,B99ECA,583,46,92,True,"Let's sing a song.          Enjoy yourselves,"
B9,bank_B9.asm,Text_2C6_Dialog_NowSingSomething,B99F26,590,24,48,True,"Now:you sing something,"
B9,bank_B9.asm,Text_2C7_Dialog_HappenedTonightCoincidentHappensToo,B99F56,594,101,202,True,"I happened to be here       tonight...well..it's        coincident...and she
happens to be here too."
B9,bank_B9.asm,Text_2C8_Romance_AhGoodEveningNinaAlways,B9A020,608,90,180,True,"Ah:good evening. Nina?      She always goes somewhere   alone.
I wonder where she's been?"
B9,bank_B9.asm,Text_2C9_Dialog_CheersBeautifulSkyinNight,B9A0D4,621,42,84,True,"Cheers for the beautiful skyin the night,"
B9,bank_B9.asm,Text_2CA_Dialog_HavingFunCheersFateStar,B9A128,628,80,160,True,"Hi, Are you having fun?     cheers for the fate of the  star of having met you,"
B9,bank_B9.asm,Text_2CB_Romance_SeeSeeShootingStarEvery,B9A1C8,639,125,250,True,"Did you see it? I see a     shooting star every year.   Don't tell anybody about
this place. It's a secret   between us. OK?"
B9,bank_B9.asm,Text_2CC_Romance_MakeWishNinaWishedTitter,B9A2C2,656,71,142,True,Did you make a wish? Nina   wished... ..titter..        it's a secret.
B9,bank_B9.asm,Text_2CD_Dialog_TakeHotSpringBathWatching,B9A350,666,91,182,True,"I take a hot spring bath:   watching stars like this.   It's just like paradise:
isn't it?"
B9,bank_B9.asm,Text_2CE_Church_MayEverybodyLiveHappilyNow,B9A406,679,53,106,True,May everybody live happily. Now let's pray together.
B9,bank_B9.asm,Text_2CF_Church_HavePrayedAlreadyAlsoImportant,B9A470,687,100,200,True,"Have you prayed already?    Also it's important to      choose a goal at the
beginning of the year."
B9,bank_B9.asm,Text_2D0_Dialog_MayEarthGiveUsGifts,B9A538,701,43,86,True,May the earth give us gifts this year too.
B9,bank_B9.asm,Text_2D1_Dialog_YearTell,B9A58E,708,35,70,True,This...this year: I'll tell her...
B9,bank_B9.asm,Text_2D2_Dialog_MayMyBusinessGoThisyear,B9A5D4,714,38,76,True,May my business go well thisyear too.
B9,bank_B9.asm,Text_2D3_Town_AlrightTellingFortuneC,B9A620,720,70,140,False,"Alright: I'm telling your   fortune.
 Yes                         No<CHOICE_OR_WAIT>c"
B9,bank_B9.asm,Text_2D4_Dialog_PickUpAnyCardLike,B9A6AC,730,92,184,False,"Pick up any card you like.
 Top                         Middle                      Bottom<CHOICE_OR_WAIT>d"
B9,bank_B9.asm,Text_2D5_Romance_ExcellentLuckGreatHarvestEverything,B9A764,743,78,156,True,"""Excellent luck""            Great harvest,              Everything goes well,"
B9,bank_B9.asm,Text_2D6_Dialog_LuckFairHarvestPersonWaiting,B9A800,754,71,142,True,"""Luck"" Fair harvest.        The person you are waiting  for will come."
B9,bank_B9.asm,Text_2D7_Town_MisfortuneNothingTurnOutGood,B9A88E,764,56,112,True,"""Misfortune""                Nothing will turn out good."
B9,bank_B9.asm,Text_2D8_Romance_SeeBetterDevelopMywayMyself,B9A8FE,772,43,86,True,I see. I'd better develop myway by myself.
B9,bank_B9.asm,Text_2D9_Dialog_WhmmmGoingGoodYear,B9A954,779,39,78,True,Whmmm:it's going to be good this year.
B9,bank_B9.asm,Text_2DA_Dialog_MayYearGoodYearfor,B9A9A2,785,37,74,True,May this year be a good yearfor you.
B9,bank_B9.asm,Text_2DB_Dialog_SeeFirstSunriseBeginningYear,B9A9EC,791,66,132,True,We should see the first     sunrise at the beginning of the year.
B9,bank_B9.asm,Text_2DC_Dialog_Best,B9AA70,801,19,38,True,well:do your best.
B9,bank_B9.asm,Text_2DD_Animal_NowAnnualEggSearchinggameAutumn,B9AA96,805,208,416,False,"Now:the annual egg searchinggame in autumn,             The rule is simple.
The first person that finds the same colored egg as the one I show wins the game.
May I begin now?
 Yes                         No<CHOICE_OR_WAIT>c"
B9,bank_B9.asm,Text_2DE_Dialog_GoFirstOne,B9AC36,832,34,68,True,"Here we go, First one is    this,"
B9,bank_B9.asm,Text_2DF_Dialog_ComeHurryUpTimeRunning,B9AC7A,838,44,88,True,"Come on, Hurry up, The time is running out."
B9,bank_B9.asm,Text_2E0_Dialog_BeatenThoseYoungKids,B9ACD2,845,40,80,True,I won't be beaten by those  young kids.
B9,bank_B9.asm,Text_2E1_Dialog_PrizeJuice,B9AD22,851,20,40,True,Is the prize juice?
B9,bank_B9.asm,Text_2E2_Dialog_SayWinnerGettheGreatPrize,B9AD4A,855,45,90,True,They say the winner will getthe great prize.
B9,bank_B9.asm,Text_2E3_Dialog_LittleKidsNeedHandicap,B9ADA4,862,27,54,True,Little kids need handicap.
B9,bank_B9.asm,Text_2E4_Dialog_AlrightTryWinYear,B9ADDA,867,39,78,True,Alright:I'll try to win     this year.
B9,bank_B9.asm,Text_2E5_Town_HearPrizeSeedRareFlower,B9AE28,873,48,96,True,I hear the prize is a seed  of the rare flower.
B9,bank_B9.asm,Text_2E6_Dialog_IfExWereFindVery,B9AE88,880,49,98,True,If <CTRL_FFFD>ex were here:he would  find it very quickly.
B9,bank_B9.asm,Text_2E7_Dialog_SameColorGetPointNext,B9AEEA,888,66,132,True,"Yes:that's the same color.  You get <CTRL_B3> point. Next is    this one,"
B9,bank_B9.asm,Text_2E8_Romance_GameOverAnnouncingWinnerEverybody,B9AF6E,898,84,168,True,OK:the game is over. I'm    announcing the winner.      Everybody:come here:please.
B9,bank_B9.asm,Text_2E9_Dialog_BingoCorrectNextOne,B9B016,910,46,92,True,"Bingo, You are correct.     Next is this one,"
B9,bank_B9.asm,Text_2EA_Animal_WinnerYearsEggFestivalMr,B9B072,917,65,130,True,"The winner of this year's   Egg Festival is             Mr. <CTRL_FFFD>ey,"
B9,bank_B9.asm,Text_2EB_Sign_YearsPrizeFodderOneWhole,B9B0F4,927,87,174,True,"This year's prize is the    fodder for one whole month, I'll deliver it to
your ranch."
B9,bank_B9.asm,Text_2EC_Dialog_CongratulationsDeliverPrizeHome,B9B1A2,939,62,124,True,"Congratulations, I'll       deliver the prize to your   home."
B9,bank_B9.asm,Text_2ED_Romance_NowEverybodyLetsBestYear,B9B21E,948,48,96,True,"Now:everybody:let's do our  best this year too,"
B9,bank_B9.asm,Text_2EE_Dialog_HumiliatingYoungMen,B9B27E,955,39,78,True,How humiliating you are:    young men.
B9,bank_B9.asm,Text_2EF_Dialog_PhewLikeUsually,B9B2CC,961,47,94,True,Phew: I just couldn't do it like I usually do.
B9,bank_B9.asm,Text_2F0_Dialog_HicHaveCome,B9B32A,968,34,68,True,Hic...shouldn't have come   here.
B9,bank_B9.asm,Text_2F1_Dialog_PuffPuff,B9B36E,974,11,22,True,Puff-puff.
B9,bank_B9.asm,Text_2F2_Dialog_PuffPuffSpeakMe,B9B384,977,44,88,True,Puff-puff...don't...speak...to me...please?
B9,bank_B9.asm,Text_2F3_Town_SeedFlowerWhoSaid,B9B3DC,984,51,102,True,Hey:it's not a seed of a    flower. Who said that?
B9,bank_B9.asm,Text_2F4_Dialog_PhewGoodHealthyBodyExercise,B9B442,992,67,134,True,Phew:it's good for healthy  body to do exercise         sometimes.
B9,bank_B9.asm,Text_2F5_Festival_NewYearsFestivalLetsGo,B9B4C8,1002,54,108,True,"New Year's Festival, Let's  go see the first sunrise,"
B9,bank_B9.asm,Text_2F6_Manual_SeedGrassThisgrassGrowsWithout,B9B534,1010,157,314,False,"That's a seed of grass. Thisgrass grows without         watering. It's <$00B7><CTRL_B2><CTRL_B2>G.
Want it?
 Buy                         Not buy                      Money <CTRL_FFFC>hv<CTRL_B2>G<CHOICE_OR_WAIT>c"
B9,bank_B9.asm,Text_2F7_Dialog_ThankDeliverShed,B9B66E,1031,42,84,True,Thank you. I'll deliver it  to your shed.
B9,bank_B9.asm,Text_2F8_Dialog_ThankVeryMuch,B9B6C2,1038,21,42,True,Thank you very much.
B9,bank_B9.asm,Text_2F9_Dialog_AhHaveEnoughMoney,B9B6EC,1042,42,84,True,Ah:you don't have enough    money for it.
B9,bank_B9.asm,Text_2FA_Dialog_ThankComeVisitMeAgain,B9B740,1049,35,70,True,Thank you. Come visit me    again.
B9,bank_B9.asm,Text_2FB_Manual_BuyingCowThenGiveBell,B9B786,1055,207,414,True,"Will you be buying a cow?   Then I'll give you this     bell.
Cows gather when they hear  the sound of this bell.     But don't ring it so often.
It makes you tired. Well:   I'll deliver it with the    cow."
B9,bank_B9.asm,Text_2FC_Shop_SpecialPaintHouseOnlyG,B9B924,1082,154,308,False,"It's the special paint for  the house only. It's <CTRL_B3><$00B7><CTRL_B2><CTRL_B2>G  but do you want to buy it?
 Yes                         No                           Money <CTRL_FFFC>hw<CTRL_B2>G<CHOICE_OR_WAIT>c"
B9,bank_B9.asm,Text_2FD_Dialog_ThankDeliverShed,B9BA58,1103,42,84,True,Thank you. I'll deliver it  to your shed.
B9,bank_B9.asm,Text_2FE_Dialog_GoodStuffThough,B9BAAC,1110,24,48,True,It's good stuff though.
B9,bank_B9.asm,Text_2FF_Dialog_HaveEnoughMoney,B9BADC,1114,42,84,True,Oh:you don't have enough    money for it.
B9,bank_B9.asm,Text_300_Animal_HorseHasBecomeBigMade,B9BB30,1121,184,368,True,"Oh:your horse has become    big. I made saddle bags for your horse.
Just put the shipping items in the saddle bags. It'll bevery convenient since your
horse will carry them for   you."
B9,bank_B9.asm,Text_301_Animal_MedicineCowsSickHealsOnly,B9BCA0,1145,250,500,False,"That's medicine for the     cows. Are they sick? It     heals only by using it
for the cows.               the price is...mmm...<CTRL_B3><CTRL_B2><CTRL_B2><CTRL_B2>G. You usually have to take
good care of them.
 Buy                         Not buy                      Money <CTRL_FFFC>hx<CTRL_B2>G<CHOICE_OR_WAIT>c"
B9,bank_B9.asm,Text_302_Dialog_DeliverShed,B9BE94,1178,34,68,True,I'll deliver it to your     shed.
B9,bank_B9.asm,Text_303_Dialog_Aha,B9BED8,1184,5,10,True,"Aha,"
B9,bank_B9.asm,Text_304_Diary_HaveEnoughMoneyComeBack,B9BEE2,1186,85,170,True,What? You don't have enough money. Come back again when you have saved enough money.
B9,bank_B9.asm,Text_305_Animal_WantTodayBuyCowSell,B9BF8C,1198,101,202,False,"Hi: what do you want today?
 Buy a cow      Sell a cow   Buy a chicken               Sell a chicken<CHOICE_OR_WAIT>e"
B9,bank_B9.asm,Text_306_Animal_NeedHaveMoreGrassRaise,B9C056,1212,48,96,True,You need to have more grass to raise livestock.
B9,bank_B9.asm,Text_307_Animal_CowCostsGBuyingOne,B9C0B6,1219,118,236,False,"A cow costs <$00B7><CTRL_B2><CTRL_B2><CTRL_B2>G so will   you be buying one?
 Buy                         Not buy                      Money <CTRL_FFFC>hy<CTRL_B2>G<CHOICE_OR_WAIT>c"
B9,bank_B9.asm,Text_308_Dialog_DeliverPen,B9C1A2,1235,29,58,True,I'll deliver it to your pen.
B9,bank_B9.asm,Text_309_Animal_IfWantSellCowsAgain,B9C1DC,1240,61,122,True,"If you want to sell cows    again:please contact me.    Bye,"
B9,bank_B9.asm,Text_30A_Animal_ChickenCostsGButWant,B9C256,1249,116,232,False,"A chicken costs <CTRL_B3><CTRL_B2><CTRL_B2><CTRL_B2>G but   do you want one?
 Buy                         Not buy                      Money <CTRL_FFFC>hz<CTRL_B2>G<CHOICE_OR_WAIT>c"
B9,bank_B9.asm,Text_30B_Dialog_ComePickUpLaterLet,B9C33E,1265,86,172,True,"OK:I'll come pick it up     later so let it be at the   entrance of your ranch
today."
B9,bank_B9.asm,Text_30C_Animal_PutCowPenTakeGood,B9C3EA,1277,116,232,True,"Hey:I put the cow in the    pen. Take good care.        Alright:the first thing is
to name it with affection.  Bye,"
B9,bank_B9.asm,Text_30D_Animal_EvenThinkSellingCowCondition,B9C4D2,1293,86,172,True,"Hey you:don't even think of selling a cow in this       condition.
Consider it again."
B9,bank_B9.asm,Text_30E_Shipping_CostsEaGWanttoSell,B9C57E,1305,110,220,False,"It costs <CTRL_FFFC>eA<CTRL_B2>G. Do you wantto sell it?
 Sell                        Not sell                     Money <CTRL_FFFC>hB<CTRL_B2>G<CHOICE_OR_WAIT>c"
B9,bank_B9.asm,Text_30F_Dialog_TakeMe,B9C65A,1320,26,52,True,"OK, I'll take it with me."
B9,bank_B9.asm,Text_310_Dialog_AcceptUntilItsgrownMore,B9C68E,1325,40,80,True,I can't accept it until it'sgrown more.
B9,bank_B9.asm,Text_311_Dialog_OutsideTakeWithyouItllEat,B9C6DE,1331,131,262,True,"It's outside so take it withyou. It'll eat grass by     himself so let it be
outside. But once it's in   the pen:feed it properly."
B9,bank_B9.asm,Text_312_Manual_MilkerMilkUsingTowardCow,B9C7E4,1349,139,278,False,"It's a milker. You can milk by using it toward a cow.   It's <CTRL_B3><$00BA><CTRL_B2><CTRL_B2>G.
 Buy                         Not buy                      Money <CTRL_FFFC>hC<CTRL_B2>G<CHOICE_OR_WAIT>c"
B9,bank_B9.asm,Text_313_Dialog_SorryButAccept,B9C8FA,1368,34,68,True,Sorry but we can't accept   that.
B9,bank_B9.asm,Text_314_Manual_BrushCowsBecomeHappyBrush,B9C93E,1374,187,374,False,"It's a brush for cows. They become happy when you brush them with affection.
Once a day is enough.       It's <$00BA><CTRL_B2><CTRL_B2>G.
 Buy                         Not buy                      Money <CTRL_FFFC>hD<CTRL_B2>G<CHOICE_OR_WAIT>c"
B9,bank_B9.asm,Text_315_Animal_FatherHeavenHelpPreciousCow,B9CAB4,1399,56,112,True,Our Father in Heaven:please help his precious cow rest.
B9,bank_B9.asm,Text_316_Animal_IdiotTellTakeCareCows,B9CB24,1407,140,280,True,"...Are you an idiot? Didn't I tell you to take care of  cows carefully?
If they become sick next    time:give them the medicine right away."
B9,bank_B9.asm,Text_317_Dialog_GreatCalfWasBornName,B9CC3C,1426,42,84,True,"Great, A calf was born, OK: I'll name it."
B9,bank_B9.asm,Text_318_Dialog_CalfAlrightName,B9CC90,1433,42,84,True,"What? .....a calf, Alright: I'll name it."
B9,bank_B9.asm,Text_319_Dialog_Name,B9CCE4,1440,29,58,True,Its name is ..... you do it.
B9,bank_B9.asm,Text_31A_Shipping_AllShippingtodayCostsGIntotal,B9CD1E,1445,95,190,True,"Is that all you are shippingtoday? It costs <CTRL_FFFC>hE<CTRL_B2>G intotal. I'll put money
in the box tomorrow."
B9,bank_B9.asm,Text_31B_Shipping_ShippingTodayBye,B9CDDC,1458,36,72,True,Is there no shipping today? OK:bye.
B9,bank_B9.asm,Text_31C_Sign_BusinessHoursWeekdayPmWeekend,B9CE24,1464,82,164,True,Business hours              Weekday: <$00B9>:<CTRL_B2><CTRL_B2>am - <$00B7>:<CTRL_B2><CTRL_B2>pm    Weekend <$0040> holiday: closed
B9,bank_B9.asm,Text_31D_Dialog_ThrowThingsSpring,B9CEC8,1476,36,72,True,Don't throw things in the   spring.
B9,bank_B9.asm,Text_31E_Manual_GoddessSpringExpectMeCome,B9CF10,1482,190,380,False,"Hi, How do you do? I'm      Goddess of Spring. Did you  expect me to come out?
By the way:I have a         question. Is this gold axe  the one you dropped.?
 Yes                         No<CHOICE_OR_WAIT>c"
B9,bank_B9.asm,Text_31F_Church_LyingYoursThisoneGodKnows,B9D08C,1507,73,146,True,You are lying. Yours is thisone. No:God knows           everything. Bye.
B9,bank_B9.asm,Text_320_Manual_FoundHonestPersonGivingThisgold,B9D11E,1518,186,372,True,"Oh yes:I've found an honest person,, I'm giving you thisgold axe.
...No:you don't have to     thank me. I'm so happy to   meet someone honest
like you. Bye now. Keep up  with your work."
B9,bank_B9.asm,Text_321_Manual_ExcuseMeButBorrowHammer,B9D292,1543,74,148,False,"Excuse me but can I borrow  your hammer?
 OK                          No<CHOICE_OR_WAIT>c"
B9,bank_B9.asm,Text_322_Animal_ThankPutMorePowerReturn,B9D326,1554,52,104,True,Thank you. I'll put it more power when I return it.
B9,bank_B9.asm,Text_323_Dialog_AskAnyMore,B9D38E,1562,34,68,True,"What? I won't ask you any   more,"
B9,bank_B9.asm,Text_324_Animal_PlowFieldBeforeSpringBut,B9D3D2,1568,103,206,True,"You can plow the field      before spring. But I hear   it's a little damaged
when it comes to spring."
B9,bank_B9.asm,Text_325_Dialog_HasRanchBecomeLively,B9D4A0,1582,49,98,True,How do you do? Has your     ranch become lively?
B9,bank_B9.asm,Text_326_Dialog_GoOut,B9D502,1590,26,52,True,You can go out from here.
B9,bank_B9.asm,Text_327_Manual_RanchUseSickleTheshedHows,B9D536,1595,111,222,False,"Hey:are you from the ranch? Do you use the sickle in theshed? How's it working?
 Very good Don't use it often<CHOICE_OR_WAIT>c"
B9,bank_B9.asm,Text_328_Dialog_WowMadeHappyMakeBetter,B9D614,1610,76,152,True,"Wow, I made it.I'm so happy.I'll make it better.        Look forward to it."
B9,bank_B9.asm,Text_329_Dialog_UseMadeAllMyEnergy,B9D6AC,1621,64,128,True,"Really? Don't you use it?   I made it with all my       energy,"
B9,bank_B9.asm,Text_32A_Dialog_ByeBye,B9D72C,1630,9,18,True,Bye-Bye.
B9,bank_B9.asm,Text_32B_Dialog_GiGiveMeSomethingEat,B9D73E,1633,33,66,True,Gi....give me something to  eat.
B9,bank_B9.asm,Text_32C_Mountain_MushroomIfPossibleWantaMushroom,B9D780,1639,44,88,True,Mushroom if possible. I wanta mushroom.....
B9,bank_B9.asm,Text_32D_Dialog_PhewAliveNowThankVery,B9D7D8,1646,152,304,True,"Phew:I'm alive now. Thank   you very much. I didn't eat anything for <CTRL_B5> days.
I need to give you          something. Take a look in   the shed tomorrow."
B9,bank_B9.asm,Text_32E_Mountain_PoisonousMushroomKillKnow,B9D908,1666,55,110,True,"That's a poisonous mushroom,It will kill you:you know."
B9,bank_B9.asm,Text_32F_Mountain_MashMushroomWantNothingBut,B9D976,1674,52,104,True,mash..mushroom... I want    nothing but a mushroom.
B9,bank_B9.asm,Text_330_Dialog_StopRabbitMineDoingLet,B9D9DE,1682,107,214,False,"Stop that,, That rabbit is  mine. What are you doing    to it?
 Let it loose                Just watching<CHOICE_OR_WAIT>c"
B9,bank_B9.asm,Text_331_Shop_IfBuyGWantPay,B9DAB4,1697,125,250,False,"If you buy it with <CTRL_B3><CTRL_B2><CTRL_B2><CTRL_B2>G:   you can do what you want.
 Pay                         Not pay                      Money <CTRL_FFFC>gF<CTRL_B2>G<CHOICE_OR_WAIT>c"
B9,bank_B9.asm,Text_332_Dialog_LiveLikeBye,B9DBAE,1714,23,46,True,I live like this. Bye.
B9,bank_B9.asm,Text_333_Romance_SeeKindWantMoneyBut,B9DBDC,1718,120,240,True,"I see...you are kind.       I don't want money. But     Everybody lives
differently. Please         understand it. Bye."
B9,bank_B9.asm,Text_334_Dialog_HandRabbitLiveLikeBye,B9DCCC,1734,61,122,True,No:I can't hand this rabbit to you. I live like this.   Bye.
B9,bank_B9.asm,Text_335_Mountain_SpiritWaterImpGaveMy,B9DD46,1743,121,242,True,"I'm the spirit here:Water   imp. You gave my fish back. You are a good man.
I give you this.            You become fine."
B9,bank_B9.asm,Text_336_Dialog_AhFirstHumanLongHad,B9DE38,1760,160,320,False,"Ah:the first human in...    well:how long had it been   since the last human
being came here? ...Hey you:are you working hard?
 Yes                         No<CHOICE_OR_WAIT>c"
B9,bank_B9.asm,Text_337_Diary_NowTakeSellExpensivePrice,B9DF78,1781,96,192,True,"Now:take this with you.     You can sell it at an       expensive price.
Work hard from now on."
B9,bank_B9.asm,Text_338_Dialog_GoHomeAsSoonAs,B9E038,1794,29,58,True,Go home as soon as possible.
B9,bank_B9.asm,Text_339_Romance_ThankLettingBloomOneHas,B9E072,1799,131,262,True,"Thank you for letting it    bloom. No one has ever      planted it before.
I'm so happy.... I want to  give something good to you."
B9,bank_B9.asm,Text_33A_Church_BothFlowerAndiDisappearSoon,B9E178,1817,96,192,True,".........Both the flower andI will disappear soon but...I will always pray for you
to be happy."
B9,bank_B9.asm,Text_33B_Shop_MiraclePotionGoodLuckMedicine,B9E238,1830,232,464,False,"That's the miracle potion.  Good luck.                  The medicine to get him
in good shape is included   and it's <$00B6><CTRL_B2><CTRL_B2><CTRL_B2>G in total:    a little expensive: huh?
 Buy                         Don't buy                    Money <CTRL_FFFC>hG<CTRL_B2>G<CHOICE_OR_WAIT>c"
