index_hex,bank,snes_addr,source_line,label,category,max_words,max_bytes,current_words,free_words,markup_text,edited_text,notes
32F,B9,B9D908,1666,Text_32E_Mountain_PoisonousMushroomKillKnow,Mountain,55,110,55,0,"That's a poisonous mushroom,It will kill you:you know.",,
330,B9,B9D976,1674,Text_32F_Mountain_MashMushroomWantNothingBut,Mountain,52,104,52,0,mash..mushroom... I want    nothing but a mushroom.,,
331,B9,B9D9DE,1682,Text_330_Dialog_StopRabbitMineDoingLet,Dialog,107,214,107,0,"Stop that,, That rabbit is  mine. What are you doing    to it?<LINE> Let it loose                Just watching<CHOICE_OR_WAIT>c",,
332,B9,B9DAB4,1697,Text_331_Shop_IfBuyGWantPay,Shop,125,250,125,0,If you buy it with <CTRL_B3><CTRL_B2><CTRL_B2><CTRL_B2>G:   you can do what you want.<LINE> Pay                         Not pay                      Money <CTRL_FFFC>gF<CTRL_B2>G<CHOICE_OR_WAIT>c,,
333,B9,B9DBAE,1714,Text_332_Dialog_LiveLikeBye,Dialog,23,46,23,0,I live like this. Bye.,,
334,B9,B9DBDC,1718,Text_333_Romance_SeeKindWantMoneyBut,Romance,120,240,120,0,I see...you are kind.       I don't want money. But     Everybody lives<LINE>differently. Please         understand it. Bye.,,
335,B9,B9DCCC,1734,Text_334_Dialog_HandRabbitLiveLikeBye,Dialog,61,122,61,0,No:I can't hand this rabbit to you. I live like this.   Bye.,,
336,B9,B9DD46,1743,Text_335_Mountain_SpiritWaterImpGaveMy,Mountain,121,242,121,0,I'm the spirit here:Water   imp. You gave my fish back. You are a good man.<LINE>I give you this.            You become fine.,,
337,B9,B9DE38,1760,Text_336_Dialog_AhFirstHumanLongHad,Dialog,160,320,160,0,Ah:the first human in...    well:how long had it been   since the last human<LINE>being came here? ...Hey you:are you working hard?<LINE> Yes                         No<CHOICE_OR_WAIT>c,,
338,B9,B9DF78,1781,Text_337_Diary_NowTakeSellExpensivePrice,Diary,96,192,96,0,Now:take this with you.     You can sell it at an       expensive price.<LINE>Work hard from now on.,,
339,B9,B9E038,1794,Text_338_Dialog_GoHomeAsSoonAs,Dialog,29,58,29,0,Go home as soon as possible.,,
33A,B9,B9E072,1799,Text_339_Romance_ThankLettingBloomOneHas,Romance,131,262,131,0,Thank you for letting it    bloom. No one has ever      planted it before.<LINE>I'm so happy.... I want to  give something good to you.,,
33B,B9,B9E178,1817,Text_33A_Church_BothFlowerAndiDisappearSoon,Church,96,192,96,0,.........Both the flower andI will disappear soon but...I will always pray for you<LINE>to be happy.,,
33C,B9,B9E238,1830,Text_33B_Shop_MiraclePotionGoodLuckMedicine,Shop,232,464,232,0,That's the miracle potion.  Good luck.                  The medicine to get him<LINE>in good shape is included   and it's <$00B6><CTRL_B2><CTRL_B2><CTRL_B2>G in total:    a little expensive: huh?<LINE> Buy                         Don't buy                    Money <CTRL_FFFC>hG<CTRL_B2>G<CHOICE_OR_WAIT>c,,
33D,B9,B9E408,1860,Text_33C_Manual_TomatoSeedEconomicalBecauseEven,Manual,200,400,200,0,It's a tomato seed. It's    economical because even     after the harvest:<LINE>you can have tomatoes if youkeep watering. It's <CTRL_B5><CTRL_B2><CTRL_B2>G.<LINE> Buy                         Don't buy                    Money <CTRL_FFFC>hH<CTRL_B2>G<CHOICE_OR_WAIT>c,,
33E,B9,B9E598,1886,Text_33D_Animal_PotatoSeedHarvestLeavesBecome,Animal,157,314,157,0,That's a potato seed. You   can harvest it when the     leaves become big.<LINE>It's <CTRL_B4><CTRL_B2><CTRL_B2>G.<LINE> Buy                         Don't buy                    Money <CTRL_FFFC>hI<CTRL_B2>G<CHOICE_OR_WAIT>c,,
33F,B9,B9E6D2,1907,Text_33E_Shipping_TurnipSeedTakeLongHarvest,Shipping,203,406,203,0,That's a turnip seed. It    doesn't take you long to    harvest so it's very<LINE>convenient. The price is    <CTRL_B4><CTRL_B2><CTRL_B2>G: convenient too: huh?<LINE> Buy                         Don't buy                    Money <CTRL_FFFC>hJ<CTRL_B2>G<CHOICE_OR_WAIT>c,,
340,B9,B9E868,1934,Text_33F_Manual_CornSeedTakestheLongestTime,Manual,236,472,236,0,That's a corn seed. It takesthe longest time to harvest but sells at a higher.<LINE>Also you can have some corn if you keep watering them   after the harvest.<LINE>It's <CTRL_B5><CTRL_B2><CTRL_B2>G.<LINE> Buy                         Don't buy                    Money <CTRL_FFFC>hK<CTRL_B2>G<CHOICE_OR_WAIT>c,,
341,B9,B9EA40,1965,Text_340_Shipping_FlowerBloomsOneDayBut,Shipping,181,362,181,0,"That's a flower. It just    blooms one day but it's goodfor a present. OK:<LINE>it's <CTRL_B5><CTRL_B2><CTRL_B2>G: the discounted   price,<LINE> Buy                         Don't buy                    Money <CTRL_FFFC>hL<CTRL_B2>G<CHOICE_OR_WAIT>c",,
342,B9,B9EBAA,1989,Text_341_Sign_FeedCowsFeedingsPerBag,Sign,198,396,198,0,That's feed for cows. <CTRL_B3><CTRL_B4>    feedings per bag but you    better feed them fodder as<LINE>much as possible.           It costs <CTRL_B3><CTRL_B2><CTRL_B2><CTRL_B2>G.<LINE> Buy                         Don't buy                    Money <CTRL_FFFC>hM<CTRL_B2>G<CHOICE_OR_WAIT>c,,
343,B9,B9ED36,2015,Text_342_Sign_FeedChickensFeedingsPerBag,Sign,225,450,225,0,It's feed for chickens. <CTRL_B3><CTRL_B4>  feedings per bag. Use it    when you don't have enough<LINE>fodder but generally you'd  better feed them fodder.    It costs <CTRL_B5><CTRL_B2><CTRL_B2>G.<LINE> Buy                         Don't buy                    Money <CTRL_FFFC>hN<CTRL_B2>G<CHOICE_OR_WAIT>c,,
344,B9,B9EEF8,2045,Text_343_Manual_SprinklerWaterVeryQuicklyCheap,Manual,209,418,209,0,"It's a sprinkler. You can   water with it very quickly, It's really cheap.<LINE>If you trade your watering  can in: we can sell it for  <CTRL_B4><CTRL_B2><CTRL_B2><CTRL_B2>G.<LINE> Buy                         Don't buy                    Money <CTRL_FFFC>hO<CTRL_B2>G<CHOICE_OR_WAIT>c",,
345,B9,B9F09A,2073,Text_344_Manual_SuperSickleInventedIfTrade,Manual,169,338,169,0,That's a super sickle. I    invented it. If you trade   your sickle in:<LINE>we can sell it for <CTRL_B4><CTRL_B2><CTRL_B2><CTRL_B2>G.<LINE> Buy                         Don't buy                    Money <CTRL_FFFC>hP<CTRL_B2>G<CHOICE_OR_WAIT>c,,
346,B9,B9F1EC,2096,Text_345_Manual_SuperHoeVeryPowerfulIf,Manual,166,332,166,0,That's a super hoe. It's    very powerful. If you trade your hoe in:<LINE>we can sell it for <CTRL_B4><CTRL_B2><CTRL_B2><CTRL_B2>G.<LINE> Buy                         Don't buy                    Money <CTRL_FFFC>hQ<CTRL_B2>G<CHOICE_OR_WAIT>c,,
347,B9,B9F338,2118,Text_346_Manual_SuperHammerKnockBigRock,Manual,200,400,200,0,That's a super hammer. It   can knock a big rock down.  Don't you want it?<LINE>If you trade your hammer in:we can sell it for <CTRL_B4><CTRL_B2><CTRL_B2><CTRL_B2>G.<LINE> Buy                         Don't buy                    Money <CTRL_FFFC>hR<CTRL_B2>G<CHOICE_OR_WAIT>c,,
348,B9,B9F4C8,2144,Text_347_Manual_SuperAxeChopLogOne,Manual,178,356,178,0,"That's a super axe. You can chop a log with one blow,   If you trade your axe in:<LINE>we can sell it for <CTRL_B4><CTRL_B2><CTRL_B2>G.<LINE> Buy                         Don't buy                    Money <CTRL_FFFC>hS<CTRL_B2>G<CHOICE_OR_WAIT>c",,
349,B9,B9F62C,2168,Text_348_Shop_CakeGoodPresentRecoveryStamina,Shop,151,302,151,0,That's a cake:good for a    present and recovery of     stamina. It's only<$00B7><CTRL_B2><CTRL_B2>G.<LINE> Buy                         Don't  buy                   Money <CTRL_FFFC>hT<CTRL_B2>G<CHOICE_OR_WAIT>c,,
34A,B9,B9F75A,2188,Text_349_Dialog_ThankPerishableSoeatWhileStill,Dialog,56,112,56,0,Thank you.It's perishable soeat while it's still fresh.,,
34B,B9,B9F7CA,2196,Text_34A_Dialog_KnowGood,Dialog,44,88,44,0,"You don't know              how good it is,",,
34C,B9,B9F822,2203,Text_34B_Animal_PlaceHatchEggsPlaceEggs,Animal,52,104,52,0,"""Place to Hatch Eggs""       Please place eggs here.",,
34D,B9,B9F88A,2211,Text_34C_Animal_ShippingBoxEggs,Animal,24,48,24,0,"""Shipping Box for Eggs""",,
34E,B9,B9F8BA,2215,Text_34D_Animal_ShippingBoxMilk,Animal,24,48,24,0,"""Shipping Box for Milk""",,
34F,B9,B9F8EA,2219,Text_34E_Animal_GetCowsGiveBirth,Animal,52,104,52,0,Get the cows in here        when they give a birth.,,
350,B9,B9F952,2227,Text_34F_Sign_TakeOutSpoutFodderCut,Sign,57,114,57,0,"""Take out spout of fodder""  Cut grass comes out of here.",,
351,B9,B9F9C4,2236,Text_350_Animal_MilkBuyingGdoAgreeMoney,Animal,113,226,113,0,Milk? I'm buying it for <CTRL_B4><CTRL_B2><CTRL_B2>GDo you agree?<LINE> Yes                         No                           Money <CTRL_FFFC>hU<CTRL_B2>G<CHOICE_OR_WAIT>c,,
352,B9,B9FAA6,2252,Text_351_Animal_MilkBuyingGbutMoneyHv,Animal,113,226,113,0,Milk? I'm buying it for <CTRL_B5><CTRL_B2><CTRL_B2>Gbut is it OK?<LINE> Yes                         No                           Money <CTRL_FFFC>hV<CTRL_B2>G<CHOICE_OR_WAIT>c,,
353,B9,B9FB88,2268,Text_352_Animal_MilkBuyingGbutMoneyHw,Animal,113,226,113,0,Milk? I'm buying it for <$00B6><CTRL_B2><CTRL_B2>Gbut is it OK?<LINE> Yes                         No                           Money <CTRL_FFFC>hW<CTRL_B2>G<CHOICE_OR_WAIT>c,,
354,B9,B9FC6A,2284,Text_353_Shop_CornBuyingGButMoney,Shop,122,244,122,0,Corn? Well...I'm buying it  for <CTRL_B4><$00B6><CTRL_B2>G but is it OK?<LINE> Yes                         No                           Money <CTRL_FFFC>hX<CTRL_B2>G<CHOICE_OR_WAIT>c,,
355,B9,B9FD5E,2301,Text_354_Shop_RipenedTomatoBuyingGBut,Shop,146,292,146,0,Yes:it's a well ripened     tomato. I'm buying it for   <CTRL_B4><CTRL_B2><CTRL_B2>G but is it OK?<LINE> Yes                         No                           Money <CTRL_FFFC>hY<CTRL_B2>G<CHOICE_OR_WAIT>c,,
356,B9,B9FE82,2321,Text_355_Shop_PotatoBuyingGButMoney,Shop,191,382,191,0,Potato? Well:I'm buying it  for <CTRL_B3><$00B8><CTRL_B2>G but is it OK?<LINE> Yes                         No                           Money <CTRL_FFFC>hZ<CTRL_B2>G<CHOICE_OR_WAIT>caaaaaaaaaaaaaaaaaaaaaaaaaaaaaaaaaaaaaaaaaaaaaaaaaaaaaaaaaaaaaaaaaaaaa,,
357,BA,BA8000,5,Text_356_Shop_TurnipGoodShapeBuyingG,Shop,137,274,137,0,Turnip? Good shape:isn't it? I'm buying it for <CTRL_B3><CTRL_B4><CTRL_B2>G but is it OK?<LINE> Yes                         No                           Money <CTRL_FFFC>h'<CTRL_B2>G<CHOICE_OR_WAIT>c,,
358,BA,BA8112,24,Text_357_Animal_FreshEggBuyingGBut,Animal,131,262,131,0,"Isn't it a fresh egg? I'm   buying it for <CTRL_B3><CTRL_B2><CTRL_B2>G but is itOK?<LINE> Yes                         No                           Money <CTRL_FFFC>h,<CTRL_B2>G<CHOICE_OR_WAIT>c",,
359,BA,BA8218,42,Text_358_Mountain_MushroomAboutGMoneyH,Mountain,107,214,107,0,Mushroom. How about <CTRL_B4><CTRL_B2><CTRL_B2>G    for it?<LINE> Yes                         No                           Money <CTRL_FFFC>h.<CTRL_B2>G<CHOICE_OR_WAIT>c,,
35A,BA,BA82EE,57,Text_359_Animal_PoisonousMushroomMedicineCompoundedAbout,Animal,172,344,172,0,It's a poisonous mushroom.  It can be a medicine when   it's compounded well.<LINE>How about <CTRL_B5><CTRL_B2><CTRL_B2>G for it?<LINE> Yes                         No                           Money <CTRL_FFFC>h?<CTRL_B2>G<CHOICE_OR_WAIT>c,,
35B,BA,BA8446,80,Text_35A_Dialog_GoodHerbAboutGMoney,Dialog,128,256,128,0,"Oh yes:it's a good herb.    Well: how about <CTRL_B4><CTRL_B2><CTRL_B2>G for it?<LINE> Yes                         No                           Money <CTRL_FFFC>h""<CTRL_B2>G<CHOICE_OR_WAIT>c",,
35C,BA,BA8546,97,Text_35B_Mountain_AhBerryWildGrapeSmells,Mountain,146,292,146,0,Ah: it's a berry of wild    grape. Smells good. How     about <CTRL_B4><CTRL_B2><CTRL_B2>G for it?<LINE> Yes                         No                           Money <CTRL_FFFC>h!<CTRL_B2>G<CHOICE_OR_WAIT>c,,
35D,BA,BA866A,117,Text_35C_Dialog_BoyTropicalFruitAboutG,Dialog,140,280,140,0,Oh boy: it's a tropical     fruit:isn't it? How about   <CTRL_B5><CTRL_B2><CTRL_B2>G for it?<LINE> Yes                         No                           Money <CTRL_FFFC>h:<CTRL_B2>G<CHOICE_OR_WAIT>c,,
35E,BA,BA8782,136,Text_35D_Shop_AhRareThingAberryFullmoon,Shop,168,336,168,0,"Ah:what a rare thing, It's aberry of Fullmoon Plant.    I'm buying it for<LINE><$00B8><CTRL_B2><CTRL_B2>G but how about it?<LINE> Yes                         No                           Money <CTRL_FFFC>h<$003B><CTRL_B2>G<CHOICE_OR_WAIT>c",,
35F,BA,BA88D2,158,Text_35E_Shop_VeryFreshFishBuyingG,Shop,137,274,137,0,It's a very fresh fish. I'm buying it for <CTRL_B5><CTRL_B2><CTRL_B2>G but how  about it?<LINE> Yes                         No                           Money <CTRL_FFFC>h<$003C><CTRL_B2>G<CHOICE_OR_WAIT>c,,
360,BA,BA89E4,177,Text_35F_Diary_Sleeping,Diary,10,20,10,0,Sleeping.,,
361,BA,BA89F8,180,Text_360_Animal_GoodLordGoldenEggNever,Animal,205,410,205,0,"Good Lord, This is a Golden Egg, I never expected to seeit with my own eyes...<LINE>Alright:<$00B7><CTRL_B2><CTRL_B2><CTRL_B2>, No:<CTRL_B3><CTRL_B2><CTRL_B2><CTRL_B2><CTRL_B2>G for it, Will you please:        please sell it to me?<LINE>Yes:yes:living longer means something for sure.",,
362,BA,BA8B92,207,Text_361_Festival_DarlingGoingFestival,Festival,42,84,42,0,Darling:aren't you going to the festival?,,
363,BA,BA8BE6,214,Text_362_Festival_GoodFestivalLikeChange,Festival,64,128,64,0,It's good to be at a        festival like this for a    change.,,
364,BA,BA8C66,223,Text_363_Festival_KnowBusyButLetsGo,Festival,54,108,54,0,I know you are busy but     let's go to the festival.,,
365,BA,BA8CD2,231,Text_364_Dialog_TraditionHundredsYearsAgoSeem,Dialog,65,130,65,0,The tradition from hundreds years ago seem nice:        I guess.,,
366,BA,BA8D54,241,Text_365_Romance_HaveHadTooMuchBeverage,Romance,73,146,73,0,Have you had too much       beverage? .....I think I    have had enough.,,
367,BA,BA8DE6,252,Text_366_Mountain_MushroomEatEatC,Mountain,50,100,50,0,"Mushroom,<LINE> Eat                         Don't eat<CHOICE_OR_WAIT>c",,
368,BA,BA8E4A,260,Text_367_Dialog_LooksLittleDangerousEatEat,Dialog,79,158,79,0,It looks a little           dangerous.<LINE> Eat                         Don't eat<CHOICE_OR_WAIT>c,,
369,BA,BA8EE8,271,Text_368_Mountain_BerryWildGrapeEatEat,Mountain,75,150,75,0,"It's the berry of wild      grape,<LINE> Eat                         Don't eat<CHOICE_OR_WAIT>c",,
36A,BA,BA8F7E,282,Text_369_Dialog_SomethingSmellsStrongEatEat,Dialog,75,150,75,0,....Something smells so     strong<LINE> Eat                         Don't eat<CHOICE_OR_WAIT>c,,
36B,BA,BA9014,293,Text_36A_Dialog_SmellsSweetNiceEatEat,Dialog,66,132,66,0,It smells sweet and nice.<LINE> Eat                         Don't eat<CHOICE_OR_WAIT>c,,
36C,BA,BA9098,303,Text_36B_Dialog_CakeEatEatC,Dialog,45,90,45,0,Cake<LINE> Eat                         Don't eat<CHOICE_OR_WAIT>c,,
36D,BA,BA90F2,310,Text_36C_Mountain_FishEatEatC,Mountain,46,92,46,0,"Fish,<LINE> Eat                         Don't eat<CHOICE_OR_WAIT>c",,
36E,BA,BA914E,317,Text_36D_Mountain_GotBerryPowerTree,Mountain,34,68,34,0,"I've got a berry of Power   Tree,",,
36F,BA,BA9192,323,Text_36E_Dialog_MainTapGasOff,Dialog,28,56,28,0,"The main tap of gas is off,",,
370,BA,BA91CA,328,Text_36F_Dialog_Burning,Dialog,14,28,14,0,It's burning.,,
371,BA,BA91E6,331,Text_370_Dialog_SniffSniffGoodSmell,Dialog,25,50,25,0,Sniff-sniff..good smell.,,
372,BA,BA9218,336,Text_371_Dialog_FlierWanttoReadC,Dialog,73,146,73,0,The flier is in. Do you wantto read it?<LINE> Yes                         No<CHOICE_OR_WAIT>c,,
373,BA,BA92AA,347,Text_372_Sign_RecoveryStaminaSpaMountains,Sign,53,106,53,0,For recovery of stamina     ...Spa in the mountains.,,
374,BA,BA9314,355,Text_373_Sign_VacationAutumnMushroomgatheringMountainsCovered,Sign,133,266,133,0,"Vacation in Autumn, Mushroomgathering in the mountains  covered with autumn leaves<LINE>The yum-yum at the mountain top, Fullmoon Plant,,",,
375,BA,BA941E,373,Text_374_Animal_ThWinterMonthThanksgivingThanksgiving,Animal,133,266,133,0,"<CTRL_B3><CTRL_B2>th of Winter Month is     Thanksgiving, For           Thanksgiving:<LINE>don't forget our            ""Smiling Mark"" eggs and     milks,",,
376,BA,BA9528,391,Text_375_Festival_RdSpringMonthFlowerFestival,Festival,76,152,76,0,"<CTRL_B4><CTRL_B5>rd of Spring Month is the Flower Festival, Enjoy      various fragrances.",,
377,BA,BA95C0,402,Text_376_Dialog_MyHomeMadePickledVegetables,Dialog,62,124,62,0,That's my home made pickled vegetables in salted rice   bran.,,
378,BA,BA963C,411,Text_377_Mountain_EvesHomeMadeBerryjuice,Mountain,35,70,35,0,That's Eve's home made berryjuice.,,
379,BA,BA9682,417,Text_378_Dialog_SuchRestlessGuy,Dialog,29,58,29,0,"You are such a restless guy,",,
37A,BA,BA96BC,422,Text_379_Romance_EverythingAllRight,Romance,25,50,25,0,"Everything is all right,",,
37B,BA,BA96EE,427,Text_37A_Church_ComeChurchLeastOnceYear,Church,50,100,50,0,I come to the church at     least once in a year.,,
37C,BA,BA9752,435,Text_37B_Town_LooksLikeArtificialFlower,Town,36,72,36,0,It looks like an artificial flower.,,
37D,BA,BA979A,441,Text_37C_Animal_LooksLikeOrnamentChickenBut,Animal,73,146,73,0,I looks like an ornament of a chicken but what is it?   It interests me.,,
37E,BA,BA982C,452,Text_37D_Dialog_Looking,Dialog,26,52,26,0,What are you looking for?,,
37F,BA,BA9860,457,Text_37E_Dialog_AhPhotoMyWife,Dialog,34,68,34,0,Ah:that's a photo of my     wife.,,
380,BA,BA98A4,463,Text_37F_Dialog_TouchWithoutPermission,Dialog,40,80,40,0,"Hey:don't touch it without  permission,",,
381,BA,BA98F4,469,Text_380_Dialog_MyGrandchildsPiggybank,Dialog,34,68,34,0,That's my grandchild's piggybank.,,
382,BA,BA9938,475,Text_381_Romance_EveBroughtJuiceSayingDrink,Romance,70,140,70,0,"Eve brought that juice here:saying ""drink it with your  grandfather.""",,
383,BA,BA99C4,485,Text_382_Dialog_WhatsWritten,Dialog,22,44,22,0,What's written in it?,,
384,BA,BA99F0,489,Text_383_Dialog_TooHeavyPickUpLooks,Dialog,53,106,53,0,It's too heavy to pick up...yes:looks pretty spooky.,,
385,BA,BA9A5A,497,Text_384_Animal_PrizeEggFestivalCharmProtect,Animal,90,180,90,0,It's a prize from the Egg   Festival. It's a charm to   protect from disasters:<LINE>they say.,,
386,BA,BA9B0E,510,Text_385_Dialog_VeryOldOrgan,Dialog,23,46,23,0,It's a very old organ.,,
387,BA,BA9B3C,514,Text_386_Church_NowLetsPray,Church,21,42,21,0,Now:let's pray here.,,
388,BA,BA9B66,518,Text_387_Dialog_QualitySulfurSpringBenefitsRheumatism,Dialog,77,154,77,0, Quality: Sulfur spring      Benefits: rheumatism        recovery of stamina,,
389,BA,BA9C00,529,Text_388_Dialog_Nothing,Dialog,18,36,18,0,Nothing in there.,,
38A,BA,BA9C24,533,Text_389_Dialog_ConfirmOriginFire,Dialog,28,56,28,0,"Confirm the origin of fire,",,
38B,BA,BA9C5C,538,Text_38A_Church_CCzGamonthEbRests,Church,95,190,95,0,<CTRL_FFFC>c&<CTRL_FFFD>cz of <CTRL_FFFD>gAMonth:        <CTRL_FFFD>eB rests here quietly.<LINE>Let's pray her soul may restin peace today.,,
38C,BA,BA9D1A,551,Text_38B_Dialog_OldLadiesGetColdEasily,Dialog,78,156,78,0,Old ladies get cold easily  so I keep the fireplace     burning all the time.,,
38D,BA,BA9DB6,562,Text_38C_Sign_NoticeSlipperyDangerousRoadTemporarily,Sign,82,164,82,0,"""Notice"" Slippery and       dangerous. This road is     temporarily closed today.",,
38E,BA,BA9E5A,574,Text_38D_Dialog_NotThis,Dialog,10,20,10,0,"Not this,",,
38F,BA,BA9E6E,577,Text_38E_Dialog_HeardSomething,Dialog,23,46,23,0,What? Heard something?,,
390,BA,BA9E9C,581,Text_38F_Animal_WinnerYearsEggFestivalLivestock,Animal,78,156,78,0,"The winner of this year's   Egg Festival is...          the livestock dealer,",,
391,BA,BA9F38,592,Text_390_Animal_BeepTimeUpNextEgg,Animal,28,56,28,0,"Beep, Time is up, Next egg.",,
392,BA,BA9F70,597,Text_391_Dialog_LateWedBetterGoHome,Dialog,38,76,38,0,It's late so we'd better go home now.,,
393,BA,BA9FBC,603,Text_392_Dialog_BetterGoHomeNow,Dialog,20,40,20,0,Better go home now.,,
394,BA,BA9FE4,607,Text_393_Sign_MountainTopMysteriousPlaceRecommend,Sign,124,248,124,0,The mountain top is a       mysterious place. I         recommend you plant a<LINE>different seed over there   when you get one.,,
395,BA,BAA0DC,624,Text_394_Animal_SaidHappyFlowerBloomsEat,Animal,106,212,106,0,It is said that a happy     flower blooms when you eat aberry of Power Tree.<LINE>It won't even die in winter.,,
396,BA,BAA1B0,639,Text_395_Dialog_WorkingHardKnowFoodLazy,Dialog,72,144,72,0,Are you working hard? You   know: No food for lazy      workers: right?,,
397,BA,BAA240,649,Text_396_Dialog_AhWorkingTooHardIsnot,Dialog,66,132,66,0,"Ah: you, Working too hard isnot good for your health:   you know.",,
398,BA,BAA2C4,659,Text_397_Dialog_DayLikeTodayGoodTothink,Dialog,186,372,186,0,Day like today: it's good tothink of your life a little seriously.<LINE>...Oh no: I shouldn't do    that...I've complained a    little unconsciously<LINE>but...well: that's what     I do: anyway.,,
399,BA,BAA438,684,Text_398_Dialog_DieWithoutMoneyMoneyNecessary,Dialog,74,148,74,0,You won't die without money.Money is not necessary to   live a full life.,,
39A,BA,BAA4CC,695,Text_399_Weather_WeatherMakesMeFeelDepressed,Weather,81,162,81,0,This weather makes me feel  depressed. It's boring...I  want to sleep in winter.,,
39B,BA,BAA56E,707,Text_39A_Dialog_WarmUpBodyCatchCold,Dialog,48,96,48,0,Hey:warm up your body..     don't catch a cold.,,
39C,BA,BAA5CE,714,Text_39B_Dialog_ColdOutsideHaveFireplaceInthe,Dialog,84,168,84,0,It's cold outside:isn't it? I have a fireplace inthe    back room so warm yourself.,,
39D,BA,BAA676,726,Text_39C_Sign_WinterMakeSomeFlowersDecorate,Sign,107,214,107,0,In winter:I make some       flowers to decorate the     shop. I want to make the<LINE>shop look nice with them.,,
39E,BA,BAA74C,741,Text_39D_Weather_HardShovelSnowButitFeels,Weather,83,166,83,0,It's hard to shovel snow butit feels good to exercise inthe morning when it snows.,,
39F,BA,BAA7F2,753,Text_39E_Weather_LikeColdnessOfwinterButLike,Weather,187,374,187,0,I don't like the coldness ofwinter but I like the smell of snow.<LINE>You can smell it before it  starts snowing: can't you?  It's like:yes it will be<LINE>snowing tomorrow.           I like that.,,
3A0,BA,BAA968,778,Text_39F_Dialog_SayGiftWorkman,Dialog,37,74,37,0,They say it a gift from the workman.,,
3A1,BA,BAA9B2,784,Text_3A0_Animal_BusyWinterGatherMaterialsThen,Animal,80,160,80,0,You are not so busy in      winter:are you? You should  gather materials: then.,,
3A2,BA,BAAA52,795,Text_3A1_Dialog_Welcome,Dialog,9,18,9,0,Welcome.,,
3A3,BA,BAAA64,798,Text_3A2_Shipping_ShippingBoxPickUpEvening,Shipping,83,166,83,0,"""Shipping Box""               Pick up in the evening.                      Shippers",,
3A4,BA,BAAB0A,810,Text_3A3_Animal_AhChickenFeather,Animal,38,76,38,0,"Ah, This is a chicken       feather?,",,
3A5,BA,BAAB56,816,Text_3A4_Dialog_SecretGardenEntryAllowed,Dialog,37,74,37,0,"""Secret Garden"" No entry    allowed,",,
3A6,BA,BAABA0,822,Text_3A5_Animal_EventsYearStSpringMonth,Animal,310,620,310,0,Events of the year          <CTRL_B3>st of Spring Month          New Year's Festival<LINE><CTRL_B4><CTRL_B5>rd of Spring Month         Flower Festival<LINE><CTRL_B3><CTRL_B4>th of Autumn Month         Harvest Festival<LINE><CTRL_B4><CTRL_B2>th of Autumn Month         Egg Festival<LINE><CTRL_B3><CTRL_B2>th of Winter Month         Thanksgiving Festival<LINE><CTRL_B4><$00B6>th of Winter Month         Star Night Festival,,
3A7,BA,BAAE0C,862,Text_3A6_Dialog_Entry,Dialog,3,6,3,0, <$0042>,,
3A8,BA,BAAE12,864,Text_3A7_Dialog_Entry,Dialog,4,8,4,0, <$0042><$0042>,,
3A9,BA,BAAE1A,866,Text_3A8_Dialog_Entry,Dialog,5,10,5,0, <$0042><$0042><$0042>,,
3AA,BA,BAAE24,868,Text_3A9_Dialog_Entry,Dialog,6,12,6,0, <$0042><$0042><$0042><$0042>,,
3AB,BA,BAAE30,870,Text_3AA_Dialog_Entry,Dialog,7,14,7,0, <$0042><$0042><$0042><$0042><$0042>,,
3AC,BA,BAAE3E,872,Text_3AB_Dialog_Entry,Dialog,8,16,8,0, <$0042><$0042><$0042><$0042><$0042><$0042>,,
3AD,BA,BAAE4E,874,Text_3AC_Dialog_Entry,Dialog,9,18,9,0, <$0042><$0042><$0042><$0042><$0042><$0042><$0042>,,
3AE,BA,BAAE60,877,Text_3AD_Dialog_Entry,Dialog,10,20,10,0, <$0042><$0042><$0042><$0042><$0042><$0042><$0042><$0042>,,
3AF,BA,BAAE74,880,Text_3AE_Dialog_Entry,Dialog,11,22,11,0, <$0042><$0042><$0042><$0042><$0042><$0042><$0042><$0042><$0042>,,
3B0,BA,BAAE8A,883,Text_3AF_Dialog_Entry,Dialog,12,24,12,0, <$0042><$0042><$0042><$0042><$0042><$0042><$0042><$0042><$0042><$0042>,,
3B1,BA,BAAEA2,886,Text_3B0_Dialog_ThThank,Dialog,20,40,20,0,......Th-thank you.,,
3B2,BA,BAAECA,890,Text_3B1_Dialog_PickUpHerbsWithoutThinking,Dialog,56,112,56,0,Don't pick up herbs without thinking what they are for.,,
3B3,BA,BAAF3A,898,Text_3B2_Dialog_ThankLooksDelicious,Dialog,39,78,39,0,Thank you. It looks         delicious.,,
3B4,BA,BAAF88,904,Text_3B3_Dialog_ThankNowBakeCake,Dialog,42,84,42,0,Thank you. Now I can bake a cake with it.,,
3B5,BA,BAAFDC,911,Text_3B4_Dialog_PlayingNastyTrickMe,Dialog,41,82,41,0,Are you playing a nasty     trick on me?,,
3B6,BA,BAB02E,918,Text_3B5_Dialog_GladGivingMeNeatPresent,Dialog,67,134,67,0,So glad. Are you giving me  this neat present?          Thank you.,,
3B7,BA,BAB0B4,928,Text_3B6_Shop_TakeCareIfBuyLot,Shop,85,170,85,0,You can't take care of them if you buy a lot of them at a time. Drop by later again.,,
3B8,BA,BAB15E,940,Text_3B7_Animal_BeingCrowdedMakesLivestockStressed,Animal,81,162,81,0,Being crowded makes         livestock stressed. That's  enough for now:you know.,,
3B9,BA,BAB200,952,Text_3B8_Dialog_Want,Dialog,17,34,17,0,I don't want it.,,
3BA,BA,BAB222,956,Text_3B9_Dialog_Trouble,Dialog,23,46,23,0,I could be in trouble.,,
3BB,BA,BAB250,960,Text_3BA_Dialog_WhatIsThis,Dialog,14,28,14,0,What is this?,,
3BC,BA,BAB26C,963,Text_3BB_Dialog_TakeKindofStuff,Dialog,38,76,38,0,What? I can't take this kindof stuff.,,
3BD,BA,BAB2B8,969,Text_3BC_Dialog_GiveMe,Dialog,28,56,28,0,What? Do you give it to me?,,
3BE,BA,BAB2F0,974,Text_3BD_Shipping_PutThingsWantSellTable,Shipping,42,84,42,0,Put things you want to sell on the table.,,
